{
  "id": "contract-release-verification-block-07-source-bound-local",
  "schema_version": "0.1.0",
  "artifact_role": "verifier_output",
  "trust_scope": "source_bound_local_release",
  "release_verification_state": "pass",
  "manifest_ref": "examples/contract-foundation/contract-manifest.example.json",
  "manifest_digest": "496ad317e2c32abb57e1500f54827e42126578b59170e61add2eb77c409a0ecb",
  "manifest_digest_status": "matched",
  "artifact_digest_status": "matched",
  "signature_profile": "sdp-trace-signature/sigstore-dsse-keyless-v1",
  "signature_status": "valid",
  "signer_identity": "local-dev-dsse-openssl-v1:d3cf17bf84b99397406aad0636e0f378075e599753dc7333f053c965a7002b31",
  "oidc_issuer": "local-dev-private-equivalent",
  "identity_policy_ref": "examples/contract-foundation/trusted-identity-policy.example.json",
  "identity_policy_status": "matched",
  "source_commit": "5616dc56603c280b28932e996d5b14fc023eafa4",
  "source_commit_status": "matched",
  "source_commit_artifact_status": "matched",
  "source_commit_artifact_counts": {
    "checked": 109,
    "missing": 0,
    "mismatched": 0
  },
  "external_trust_profile": "not_assessed",
  "external_attestation_ref": null,
  "transparency_evidence_ref": null,
  "source_uri_status": "not_assessed",
  "protected_ref_status": "not_assessed",
  "workflow_identity_status": "not_assessed",
  "approval_status": "not_assessed",
  "production_release_verified": {
    "state": "not_assessed",
    "value": null,
    "reason": "Production release verification requires external attestation in addition to local digest and DSSE checks."
  },
  "transparency_log_status": "not_assessed",
  "freshness_status": "current",
  "verified_at": "2026-05-03T18:00:10Z",
  "trusted_contract_release": false,
  "private_equivalent_profile": "local-dev-dsse-openssl-v1",
  "provenance_refs": [
    "provenance-codex-block-07-slice-7-start"
  ],
  "accountability": {
    "dri": {
      "identity_ref": "role:sdp-trace-release-captain",
      "actor_type": "human_role"
    },
    "approver": {
      "identity_ref": "role:sdp-trace-cto",
      "actor_type": "human_role"
    },
    "escalation": {
      "identity_ref": "role:sdp-trace-cto",
      "actor_type": "human_role"
    },
    "authority_scope": "contract_release",
    "accountability_claim": "release_approval",
    "approval_ref": "specs/001-sdp-trace-time-series-evidence-substrate/blocks/01-contract-foundation.md",
    "risk_owner": {
      "identity_ref": "role:sdp-trace-risk-owner",
      "actor_type": "human_role"
    },
    "line_of_defense": "second"
  },
  "source_commit_reason": "source_commit contains every manifest artifact path with matching digest",
  "external_trust_reason": "No Sigstore/Rekor bundle or customer PKI attestation is committed for this local development proof."
}
